{
 "$schema":"https://json-schema.org/draft/2020-12/schema",
 "$id":"https://example.invalid/motion-sync-v1.0.0.schema.json",
 "type":"object","additionalProperties":false,
 "required":["schema_version","status","format","voice","beats_per_minute","beat_origin_frame","scenes","titles","sound_cues","sources"],
 "properties":{
  "schema_version":{"const":"motion-sync-v1.0.0"},"status":{"type":"string","minLength":1},"voice":{"type":"string","minLength":1},"beats_per_minute":{"type":"number","exclusiveMinimum":0},"beat_origin_frame":{"type":"integer","minimum":0},
  "format":{"type":"object","additionalProperties":false,"required":["width","height","fps","duration_frames"],"properties":{"width":{"type":"integer","minimum":1},"height":{"type":"integer","minimum":1},"fps":{"type":"integer","minimum":1},"duration_frames":{"type":"integer","minimum":1}}},
  "scenes":{"type":"array","minItems":1,"items":{"type":"object","additionalProperties":false,"required":["id","start","end","voice_start","voice_duration","caption_lines"],"properties":{"id":{"type":"string"},"start":{"type":"integer","minimum":0},"end":{"type":"integer","minimum":1},"voice_start":{"type":"integer","minimum":0},"voice_duration":{"type":"number","exclusiveMinimum":0},"caption_lines":{"type":"array","minItems":1,"items":{"type":"array","minItems":1,"items":{"type":"string","minLength":1}}}}}},
  "titles":{"type":"array","minItems":1,"items":{"type":"object","additionalProperties":false,"required":["id","start","end","lines","cue","style"],"properties":{"id":{"type":"string"},"start":{"type":"integer","minimum":0},"end":{"type":"integer","minimum":1},"lines":{"type":"array","minItems":1,"items":{"type":"string","minLength":1}},"cue":{"type":"string"},"style":{"enum":["burst","left","right"]}}}},
  "sound_cues":{"type":"array","minItems":1,"items":{"type":"object","additionalProperties":false,"required":["id","frame","type","reason"],"properties":{"id":{"type":"string"},"frame":{"type":"integer","minimum":0},"type":{"enum":["impact","tick"]},"reason":{"type":"string"}}}},
  "sources":{"type":"array","minItems":1,"items":{"type":"string","format":"uri"}}
 }
}
